,date,min_temp,max_temp,max_wind_dir,max_wind_sp,rain_24h,note
0,03 ก.ย. 65,24.6,34.5,180,11.1,ไม่มีฝน,เช้า-เย็น เมฆมาก ทัศนวิสัยดี ลมสงบ ส่วนตอนกลางคืน มีฟ้าคะนองและฟ้าแลบเกิดขึ้น เมฆมาก ทัศนวิสัยดี ลมสงบ
1,02 ก.ย. 65,24.4,34.5,080,16.7,ไม่มีฝน,เช้า-ค่ำ มีเมฆมาก ทัศนวิสัยดี ช่วงบ่ายมีฟ้าคะนอง ลมอ่อน ส่วนกลางคืน เมฆลดลง ลมสงบ
2,01 ก.ย. 65,24.0,36.1,080,13.0,4.2,"เช้า-ค่ำ มีฝนฟ้าคะนอง ทัศนวิสัย 7-12 กม. ลมพัดเป็นระยะ
ส่วนกลางคืนลมสงบ"
3,31 ส.ค. 65,25.5,35.4,300,24.1,20.5,เช้า มีเมฆมาก ทัศนวิสัยดี ลมสงบ บ่าย มีเมฆมาก มีฝนฟ้าคะนอง ฝนตกปานกลาง ลมแรง ส่วนกลางคืน ลมสงบ
4,30 ส.ค. 65,25.4,35.4,070,14.8,0.1,"เช้า-ค่ำ เมฆมาก มีฝนฟ้าคะนองขนาดเบาเกิดขึ้น ทัศนวิสัย 10-12 กิโลเมตร ลมอ่อน 
ส่วนตอนกลางคืน เมฆเป็นส่วนมาก ทัศนวิสัย 10 กิโลเมตร ลมสงบ"
5,29 ส.ค. 65,24.6,31.4,140,13.0,3.6,"เช้า-ค่ำ มีเมฆมาก และมีฝน ทัศนวิสัย 10-12 กม. ลมพัดเป็นระยะ
ส่วนกลางคืนลมสงบ"
6,28 ส.ค. 65,23.5,34.6,070,13.0,ไม่มีฝน,เช้า-ค่ำ มีเมฆมาก ทัศนวิสัยดั ลมอ่อน  ช่วงบ่าย มีฟ้าคะนอง ลมอ่อน ส่วนกลางคืน ลมสงบ
