,date,min_temp,max_temp,max_wind_dir,max_wind_sp,rain_24h,note
0,03 ก.ย. 65,23.4,29.8,210,44.5,17.2,ท้องฟ้ามีเมฆมาก มีฝนตก ลมสูงสุด ทิศ 210 ความเร็วลม 24 นอต ทัศนวิสัย 8-10 กม. ทะเลมีคลื่นเล็กน้อย
1,02 ก.ย. 65,23.9,30.8,240,33.4,109.4,ท้องฟ้ามีเมฆมากกับมีฝนตกหนักตอนเช้าและตอนดึก ลมสูงสุดทิศ 240 ความเร็ว 18 นอต ทะเลมีคลื่นเล็กน้อย
2,01 ก.ย. 65,24.2,32.4,240,40.8,29.6,ท้องฟ้ามีเมฆมากกับมีฝนและฝนฟ้าคะนองตกตอนค่ำ ลมสูงสุดทิศ 240 ความเร้ว 22 นอต ทะเลมีคลื่นเล็กน้อย
3,31 ส.ค. 65,24.8,31.2,250,35.2,27.0,ท้องฟ้ามีเมฆเป็นส่วนมาก มีฝนตก ลมสูงสุด ทิศ 250 ความเร็วลม 19 นอต ทัศนวิสัย 10 กม ทะเลสงบ
4,30 ส.ค. 65,24.5,30.7,210,35.2,42.4,ท้องฟ้ามีเมฆเป็นส่วนมาก มีฝนตก ลมสูงสุด ทิศ 210 ความเร็วลม 19 นอต ทัศนวิสัย 9-10 กม. ทะเลเรียบ
5,29 ส.ค. 65,24.2,29.7,260,29.7,ไม่มีฝน,ท้องฟ้ามีเมฆมาก ทัศนะวิสัยดี ลมสูงสุดทิศ 260 ความเร็ว 16 นอต ทะเลเรียบ
6,28 ส.ค. 65,24.0,31.5,250,33.4,3.6,ท้องฟ้ามีเมฆเป็นส่วนมากกับมีฝนตะตอนเช้า ลมสูงสุดทิศ 250 ความเร็ว 18 นอต ทะเลเรียบ
