,date,min_temp,max_temp,max_wind_dir,max_wind_sp,rain_24h,note
0,03 ก.ย. 65,23.8,32.4,220,27.8,45.8,ตอนเช้ามีฟ้าหลัวชื้น สายทัศนวิสัยดี บ่ายถึงเย็นมีฝนตกและฝนฟ้าคะนอง ดึกมีฟ้าแลบทิศใต้ มีเมฆมากตลอดวัน ลมเฉลี่ยทิศตะวันตกเฉียงใต้
1,02 ก.ย. 65,23.5,31.7,240,27.8,2.7,ช่วงเช้าเมฆเต็มท้องฟ้า ฟ้าหลัวชื้นและน้ำค้างปกคลุม ฝนธรรมดา บ่ายถึงค่ำเมฆลดลงช่วงค่ำ ฝนธรรมดา ลมแรงบางเวลา กลางคืนเมฆบางส่วน ลมสงบ
2,01 ก.ย. 65,24.1,34.5,180,29.7,27.7,ตอนเช้ามีฟ้าหลัวชื้นและมีหมอก สายทัศนวิสัยดี บ่ายถึงเย็นมีฟ้าคะนองและฝนฟ้าคะนอง มีเมฆเป็นส่วนมาก
3,31 ส.ค. 65,24.4,34.6,140,44.5,23.5,เกิดหมอกในตอนเช้า เมฆมาก มีน้ำค้างจัด ลมสงบ ตอนเที่ยงเมฆมาก ลมสงบ ตอนบ่ายได้ยินเสียงฟ้าร้องทางทิศ ซอ.ต่อมามีฝนตกฟ้าคะนอง เมฆมาก ลม 4-5 นอต ตอนค่ำถึงดึก เมฆมาก ลมสงบ ทัศนวิสัยตลอดวัน 0.6-12 กิโลเมตร
4,30 ส.ค. 65,23.7,32.4,260,22.2,1.8,เช้ามีเมฆมากกับมีฟ้าหลัวชื้นหนาในตอนเช้า สายอากาศดีขึ้น มีเมฆมากกับมีฝนตกเบาๆเล็กน้อยเป็นช่วงๆในตอนบ่ายถึงเย็น ค่ำ อากาศดีจนถึงดึก
5,29 ส.ค. 65,24.9,30.2,220,20.4,ฝนเล็กน้อย,ช่วงเช้าเมฆเต็มท้องฟ้า ฟ้าหลัวชื้นและน้ำค้างปกคลุม บ่ายถึงค่ำเมฆเต็มท้องฟ้า ฝนธรรมดาตกต่อเนื่อง ลมพัดเบาๆ กลางคืนมีเมฆเป็นส่วนมาก ลมสงบ อากาศดี
6,28 ส.ค. 65,23.6,32.4,200,22.2,0.3,มีเมฆมากกับมีน้ำค้างเล็กน้อยในตอนเช้า สายอากาศดีขึ้นตลอดทั้งวันกับมีฝนเล็กน้อยในตอนบ่าย ลมอ่อนส่วนมากทิศ ว. ค่ำมีฟ้าแลบทิศ อ.กับอากาศดีจนถึงดึก
