,date,min_temp,max_temp,max_wind_dir,max_wind_sp,rain_24h,note
0,03 ก.ย. 65,25.7,34.0,270,14.8,ไม่มีฝน,มีฟ้าหลัวทัศนวิสัยไม่ดี เมฆเป็นส่วนมาก
1,02 ก.ย. 65,26.5,34.5,210,16.7,0.4,มีฟ้าหลัว ทัศนวิสัยไม่ดี เมฆเป็นส่วนมาก ฝนธรรมดาตก
2,01 ก.ย. 65,25.0,33.6,050,14.8,ไม่มีฝน,ท้องฟ้ามีเมฆมากกับมีอากาศร้อนในตอนกลางวัน ลมตะวันออกเฉียงเหนือกำลังอ่อน
3,31 ส.ค. 65,26.0,32.6,180,31.5,5.4,มีเมฆมากกับมีฟ้าหลัว ช่วงสายมีฝนฟ้าคะนองเวลา 11.15-13.15 น.และมีฝนธรรมดาตกเวลา 13.15-13.40 น.
4,30 ส.ค. 65,25.2,33.8,180,20.4,0.6,มีเมฆเป็นส่วนมากกับมีฟ้าหลัวในตอนเช้า และมีฝนธรรมดาตกเวลา 12.10-12.30 น.
5,29 ส.ค. 65,24.0,33.3,130,37.1,13.0,มีฟ้าหลัวทัศนวิสัยไม่ดี เมฆเป็นส่วนมากฝนฟ้าคะนอง
6,28 ส.ค. 65,25.5,35.0,360,14.8,29.2,ท้องฟ้ามีเมฆบางส่วน กับมีฝนฟ้าคะนองในช่วงดึก วัดปริมาณน้ำฝนได้ 29.2 มม.
