,date,min_temp,max_temp,max_wind_dir,max_wind_sp,rain_24h,note
0,03 ก.ย. 65,25.1,34.2,240,29.7,0.2,"ดึก-เช้า ลมสงบ  เมฆมาก มีน้ำค้างและฟ้าหลัวชื้น ทัศนวิสัย 2-8 กม.
สาย-บ่าย ลมทิศ ซซว.-ว. กำลัง 2-3 นอต  เมฆมาก มีฟ้าหลัวชื้นและมีฝนฟ้าคะนอง ทัศนวิสัย 8-10 กม.
เย็น-ค่ำ ลมสงบ เมฆมาก  ทัศนวิสัย 10  กม."
1,02 ก.ย. 65,24.7,36.6,060,27.8,3.2,"ดึก-เช้า ลมทิศ วซว. กำลัง 2 นอต  เมฆบางส่วน มีน้ำค้างและฟ้าหลัวชื้น ทัศนวิสัย 8-10 กม.
สาย-บ่าย ลมทิศ นว.-น. กำลัง 2 นอต  เมฆมาก มีฝนฟ้าคะนองและฝนธรรมดาตกต่อเนื่อง ทัศนวิสัย 6-8 กม.
เย็น-ค่ำ ลมทิศ น. กำลัง 2 นอต เมฆมาก มีฟ้าหลัว  ทัศนวิสัย 8  กม."
2,01 ก.ย. 65,24.9,35.6,020,25.9,ไม่มีฝน,"ดึก-เช้า ลมสงบ  เมฆมาก มีน้ำค้างและฟ้าหลัวชื้น ทัศนวิสัย 2-7 กม.
สาย-บ่าย ลมทิศ ซซว.-อ. กำลัง 2 นอต  เมฆมาก ทัศนวิสัย 10 กม.
เย็น-ค่ำ ลมทิศ วนว. กำลัง 3 นอต เมฆเป็นส่วนมาก  ทัศนวิสัย 10  กม."
3,31 ส.ค. 65,24.5,34.5,230,31.5,20.2,ดึก-เช้า มีน้ำค้างและฟ้าหลัวชื้น ลมสงบ เมฆมาก ทัศนวิสัย 3-10 กม.สาย-บ่าย ลมสงบ เมฆมาก ทัศนวิสัย 5-8 กม.มีฟ้าหลัว เย็น-ค่ำ มีฝนธรรมดาตกต่อเนื่อง ลมสงบ เมฆมาก ทัศนวิสัย 7-8 กม.มีฟ้าหลัวชื้น
4,30 ส.ค. 65,24.5,34.5,200,24.1,ไม่มีฝน,ดึก-เช้า มีหมอก น้ำค้างและฟ้าหลัวชื้น ทัศนวิสัยต่ำสุด 800 เมตร ลมสงบ เมฆมาก สาย-บ่าย ลมสงบ เมฆมาก ทัศนวิสัย 10 กม.เย็น-ค่ำ ลมสงบ เมฆเป็นส่วนมาก ทัศนวสัย 10 กม.
5,29 ส.ค. 65,25.1,33.5,210,25.9,10.4,ดึก-เช้า มีน้ำค้างและฟ้าหลัวชื้น ลมสงบ เมฆมาก ทัศนวิสัย 0.8-10 กม.มีหมอก และพายุฟ้าคะนอง สาย-บ่าย ลมสงบ เมฆมาก ทัศนวิสัย 5-10 กม.มีฟ้าหลัวชื้น และพายุฝนฟ้าคะนอง เย็น-ค่ำ ลมทิศ อนอ.-ซว.กำลัง 2 นอต เมฆมาก ทัศนวิสัย 10 กม.มีพายุฝนฟ้าคะนอง
6,28 ส.ค. 65,25.0,36.2,090,14.8,0.2,ดึก-เช้า มีน้ำค้างและฟ้าหลัวชื้น ลมสงบ เมฆมาก ทัศนวิสัย 5-10 กม.สาย-บ่าย ลมทิศ อ.-ซซว.กำลัง 2-3 นอต เมฆมาก ทัศนวิสัย 7-10 กม.มีฟ้าหลัว เย็น-ค่ำ ลมสงบ เมฆมาก ทัศนวิสัย 10 กม.
