,date,min_temp,max_temp,max_wind_dir,max_wind_sp,rain_24h,note
0,10 ก.ย. 65,24.1,30.2,260,18.5,1.2,สรุปลักษณะอากาศ วันที่ 10 ก.ย. 65 มีเมฆมากปกคลุมตลอดทั้งวัน มีแสงแดดในช่วงสายๆระยะสั้น มีเมฆ cb ก่อตัวในช่วงบ่าย ทำให้มีฝนฟ้าคะนอง ในระยะ 4-5 กม.  และฝนธรรมดาขนาดเบา ทัศนวิสัย 10-12 กม. ลมทิศ ซว ความเร็ว 10-20 กม./ชม.
1,09 ก.ย. 65,24.5,27.1,030,14.8,10.1,เมฆมาก-เต็มท้องฟ้า มีฝนตกเป็นระยะ บางช่วงมีฝนตกต่อเนื่อง เป็นฝนธรรมดาขนาดอ่อน-ปานกลาง  ทัศนวิสัยดี 10 กม.เป็นส่วนมาก  ช่วงเวลาที่ฝนตก ทัศนวิสัยปานกลาง 5 กม. ลมสงบส่วนมาก.
2,08 ก.ย. 65,23.6,28.2,100,14.8,25.3,ร่องมรสุมกำลังแรงยังคงพาดผ่านภาคกลาง เข้าสู่หย่อมความกดอากาศต่ำบริเวณภาคตะวันออกและภาคตะวันออกเฉียงเหนือตอนล่าง ทำให้มีเมฆปกคลุมตลอดทั้งวัน และมีฝนตกต่อเนื่องตั้งแต่ช่วงเช้าถึงเที่ยง ฝนเคลื่อนตัวจากทิศ อซอ ไปทิศ วนว ลมทิศตะวันออก ความเร็ว 5-20 กม./ชม. ทัศนวิสัย ช่วงมีฝน 2-5 กม. ช่วงปกติ 10 กม.
3,07 ก.ย. 65,23.2,33.2,070,35.2,ไม่มีฝน,สภาพอากาศโดยรวมดีขึ้นตั้งแต่ช่วงสายๆ ตลอดทั้งวันท้องฟ้ามีเมฆเป็นส่วนมาก ทัศนวิสัย 10 กม. ลมส่วนใหญ่เป็นลมทิศ นอ. -ทิศ อ. กำลังปานกลาง โดยมีลมพัดแรงเป็นระยะๆ อากาศตลอดทั้งวันไม่ร้อนมากนัก และไม่มีฝนตก
4,06 ก.ย. 65,25.2,31.6,110,27.8,55.2,"เช้าตรู่เมฆมาก อากาศดี  ลมสงบ  ช่วงสายเมฆมาก-กลางวันแดดร้อนอบอ้าว ลมอ่อน ทิศ ซ  เริ่มมีฝนตก 10.40น.และช่วงบ่าย เมฆมาก มีฝนฟ้าคะนอง 14.00น. ,17.25น.และฝนธรรมดา ลมแรงครั้งคราว  ช่วงค่ำ - กลางคืน เมฆเล็กน้อย ฝนเล็กน้อยบางแห่ง  ช่วงดึกมีฝนฟ้าคะนอง  ตลอดช่วงวัน ทัศนวิสัยดี 10 กม. ช่วงฝนตกทัศนวิสัยปานกลาง 5-6กม."
5,05 ก.ย. 65,24.9,32.6,290,27.8,0.2,สรุปลักษณะอากาศ วันที่ 5 กันยายน 2565 ร่องมรสุมกำลังแรงจะเลื่อนลงมาพาดผ่าน ภาคตะวันออกเฉียงเหนือ ทำให้มีเมฆปกคุลมตลอดทั้งวัน มีฝนระยะไกล ในช่วงบ่าย ทางทิศ น ทัศนวิสัย 10-12 กม. อากาศร้อนอบอ้าวในตอนกลางวัน ช่วงค่ำมีฝนขนาดเบา และมีฝนฟ้าคะนองระยะไกลทิศ ซ ช่วง 21.00-22.00 น. ลมทิศ ซว ความเร็ว 5-15 กม./ชม.
