,date,min_temp,max_temp,max_wind_dir,max_wind_sp,rain_24h,note
0,11 ก.ย. 65,17.5,20.0,130,24.1,234.4,ทัศนวิสัยไม่ดี มีลมกำลังปานกลาง มีหมอกปกคลุมตลอดทั้งวัน และมีฝนตกต่อเนื่องขนาดปานกลางตกต่อเนื่องทั้งวัน
1,10 ก.ย. 65,17.0,19.0,140,29.7,46.5,ทัศนวิสัยไม่ดี มีลมกำลังปานกลาง มีเมฆปกคลุมท้องฟ้ามากกว่าครึ่งตลอดทั้งวัน และมีฝนตกต่อเนื่องขนาดปานกลางตกต่อเนื่องทั้งวัน
2,09 ก.ย. 65,16.5,19.5,120,35.2,52.1,ทัศนวิสัยไม่ดี มีลมกำลังปานกลาง มีเมฆปกคลุมท้องฟ้ามากกว่าครึ่งตลอดทั้งวัน และมีฝนตกต่อเนื่องขนาดปานกลางตกต่อเนื่องทั้งวัน
3,08 ก.ย. 65,18.5,20.5,140,40.8,22.5,ทัศนวิสัยดีในช่วงเช้า มีลมกำลังปานกลาง มีเมฆปกคลุมท้องฟ้ามากกว่าครึ่งบางเวลา และมีฝนตกต่อเนื่องขนาดปานกลางในช่วงเวลา 04.00-06.00น.
4,07 ก.ย. 65,18.0,22.0,120,35.2,ไม่มีฝน,ทัศนวิสัยดีบางเวลา มีลมกำลังปานกลาง มีเมฆปกคลุมท้องฟ้ามากกว่าครึ่งบางเวลา มีหมอกหนาจัด
5,06 ก.ย. 65,16.3,21.5,130,33.4,0.2,ทัศนวิสัยดี มีลมกำลังปานกลาง มีเมฆปกคลุมท้องฟ้ามากกว่าครึ่งตลอดวันและมีฝนตกบางช่วงเวลา
6,05 ก.ย. 65,18.0,20.5,100,31.5,16.8,ทัศนวิสัยไม่ดี มีลมกำลังปานกลาง มีเมฆปกคลุมท้องฟ้ามากกว่าครึ่งตลอดวันและมีฝนตกบางช่วงเวลา
