,date,min_temp,max_temp,max_wind_dir,max_wind_sp,rain_24h,note
0,11 ก.ย. 65,22.9,28.0,140,33.4,2.7,ฝนตกปรอยๆตลอดทั้งวัน ทัศนวิสัย 7-10 กม.
1,10 ก.ย. 65,22.3,31.9,090,22.2,42.4,มีเมฆเต็มท้องฟ้าเกือบตลอดทั้งวัน กับมีฝนตกหนัก โดยมีฝนตกเป็นระยะๆ ส่วนมากตอนบ่ายและกลางคืน
2,09 ก.ย. 65,22.8,29.9,090,18.5,55.7,ท้องฟ้ามีเมฆปกคลุมเต็มท้องฟ้าเกือบตลอดทั้งวัน กับมีฝนตกหนักเป็นระยะๆ ต่อเนื่อง ส่วนมากในตอนสาย บ่าย ค่ำ และกลางคืน
3,08 ก.ย. 65,22.0,30.9,130,18.5,18.5,ท้องฟ้ามีเมฆมาก-เต็มท้องฟ้ากับมีฝนตกปานกลางเป็นระยะๆ ส่วนมากตอนบ่ายและกลางคืน ทัศนวิสัยดี 10-12 กม.
4,07 ก.ย. 65,23.6,32.5,050,44.5,29.9,มีฝนฟ้าคะนอง เป็นช่วงๆตลอดทั้งวัน และมีเมฆมากตลอดวัน ทัศนวิสัย 7-10 กม.
5,06 ก.ย. 65,23.8,34.6,140,46.3,21.8,เช้าอากาศดี บ่ายอากาศไม่ร้อนมาก ค่ำมีฝนฟ้าคะนอง ทัศนวิสัย 10-13 กม.
6,05 ก.ย. 65,23.0,34.0,030,37.1,ไม่มีฝน,เช้าอากาศดี บ่ายค่ำอากาศไม่ร้อนมาก ทัศนวิสัย 10 กม.
