,date,min_temp,max_temp,max_wind_dir,max_wind_sp,rain_24h,note
0,11 ก.ย. 65,27.1,33.3,290,27.8,ไม่มีฝน,มีเมฆเป็นส่วนมากกับมีอากาศร้อนในตอนกลางวัน ลมฝ่ายตะวันตก ทัศนวิสัยดี
1,10 ก.ย. 65,25.7,34.2,280,25.9,ไม่มีฝน,มีเมฆส่วนมาก ลมตะวันตก ทัศนวิสัยดี
2,09 ก.ย. 65,25.9,34.0,210,24.1,ไม่มีฝน,เมฆบางส่วน ลมฝ่ายตะวันตก ทัศนวิสัยดี
3,08 ก.ย. 65,25.3,32.7,250,25.9,ไม่มีฝน,มีเมฆเป็นส่วนมาก ลมฝ่ายตะวันตก ทัศนวิสัยดี
4,07 ก.ย. 65,24.9,30.4,300,27.8,3.2,มีเมฆมาก ฝน 3.2 มม. ลมตะวันตกเฉียงใต้  ทัศนวิสัยดี
5,06 ก.ย. 65,25.9,32.0,310,37.1,3.1,เมฆเป็นส่วนมาก มีฝนธรรมดาตกตอนหัวรุ่ง และตอนกลางคืน ลมฝ่ายตะวันตก ทัศนวิสัย 8-10 กม.
6,05 ก.ย. 65,26.5,32.0,280,25.9,0.4,มีเมฆมากกับมีฝนในช่วงเช้ามืด ลมฝ่ายตะวันตก
