,date,min_temp,max_temp,max_wind_dir,max_wind_sp,rain_24h,note
0,11 ก.ย. 65,23.4,29.6,350,13.0,3.8,ท้องฟ้ามีเมฆมาก  และมีฝนธรรมดาตกต่อเนื่อง  ทัศนวิสัยดี  ลมแปรปรวน ความเร็วลม 10-20 กม./ชม
1,10 ก.ย. 65,23.5,32.6,150,27.8,32.2,ท้องฟ้ามีเมฆมาก  และมีฝนธรรมดาตกต่อเนื่อง  ทัศน8-10 กม. ลมแปรปรวน ความเร็วลม 10-20 กม./ชม
2,09 ก.ย. 65,24.5,30.6,270,27.8,0.4,ท้องฟ้ามีเมฆมาก  และมีฝนธรรมดาตก   ทัศนวิสัยดี ลมตะวันออกเฉียงใต้ ความเร็วลม 10-30 กม./ชม
3,08 ก.ย. 65,25.0,30.8,060,24.1,7.6,ท้องฟ้ามีเมฆมาก ช่วงเช้ามีฟ้าหลัวชื้น มีฝนธรรมดาและนตกต่อเนื่อง    ทัศนวิสัยดี ลมตะวันออกเฉียงใต้ ความเร็วลม 10-30 กม./ชม
4,07 ก.ย. 65,26.0,34.0,070,25.9,1.6,ท้องฟ้ามีเมฆส่วนมาก   ทัศนวิสัยดี ลมแปรปวน  ความเร็วลม 10-30 กม./ชม
5,06 ก.ย. 65,24.4,34.0,050,20.4,ไม่มีฝน,ท้องฟ้ามีเมฆบางส่วน   ทัศนวิสัยดี ลมแปรปวน  ความเร็วลม 10-30 กม./ชม
6,05 ก.ย. 65,24.2,33.5,270,22.2,2.4,ท้องฟ้ามีเมฆเป็นบางส่วน  มีฝนฟ้าคะนอง ทัศนวิสัยดี ลมตะวันออกเฉียงใต้  ความเร็วลม 10-20 กม./ชม
