,date,min_temp,max_temp,max_wind_dir,max_wind_sp,rain_24h,note
0,11 ก.ย. 65,25.4,33.8,250,37.1,28.2,มีฝนฟ้าคะนองในช่วงค่ำ กับมีลมแรงบางช่วงเวลา ลมตะวันตกเฉียงเหนือ ความเร็ว 10-35 กิโลเมตร/ชั่วโมง
1,10 ก.ย. 65,26.4,32.5,300,46.3,1.3,เมฆเป็นส่วนมาก มีฝนตกเล็กน้อยในช่วงเย็นและกลางคืน ทัศนวิสัยดีตลอดทั้งวัน ลมตะวันตกเฉียงเหนือ ความเร็ว 10-30 กิโลเมตร/ชั่วโมง
2,09 ก.ย. 65,25.2,32.5,200,24.1,ไม่มีฝน,เมฆเป็นส่วนมาก ทัศนวิสัยดีตลอดทั้งวัน ลมตะวันตกเฉียงใต้ ความเร็ว 10-20 กิโลเมตร/ชั่วโมง
3,08 ก.ย. 65,24.6,30.5,250,22.2,ฝนเล็กน้อย,มีฝนตกเล็กน้อย ลมตะวันตกความเร็ว 10 - 20 กิโลเมตรต่อชั่วโมง
4,07 ก.ย. 65,24.8,30.7,240,29.7,5.6,เมฆมาก กับมีฝนธรรมดาขนาดเบาตกต่อเนื่องในตอนกลางคืน ลมตะวันตกเฉียงใต้ ความเร็ว 10-30 กม./ชม.
5,06 ก.ย. 65,25.9,31.9,210,33.4,8.0,มีเมฆเป็นส่วนมาก ได้ยินเสียงฟ้าร้องทางทิศเหนือในตอนบ่าย มีฝนธรรมดาขนาดเบาตกต่อเนื่องกันในตอนกลางคืน ลมตะวันตกเฉียงใต้ ความเร็ว 10-20 กม./ชม.
6,05 ก.ย. 65,25.0,31.6,240,35.2,ไม่มีฝน,มีเมฆเต็มท้องฟ้าในตอนเช้าและมีเมฆเป็นส่วนมากในตอนบ่าย ทัศนวิสัยดี ลมตะวันตกเฉียงใต้ ความเร็ว 10-20 กม./ชม.
