,date,min_temp,max_temp,max_wind_dir,max_wind_sp,rain_24h,note
0,10 ก.ย. 65,24.9,32.4,180,24.1,6.2,มีฟ้าหลัวและน้ำค้างในตอนดึกถึงเช้า ทัศนวิสัย 8-10 กม. ลมทิศ 120-180 กำลัง 5-9 นอต ท้องฟ้ามีเมฆมากตลอดช่วงวัน และมีฝนฟ้าคะนองในตอนบ่าย
1,09 ก.ย. 65,23.6,30.4,120,22.2,0.6,หลังเที่ยงคืนมามีเมฆมาก ลมสงบ กับมีฝนฟ้าคะนอง และฝนตกต่อเนื่อง เวลา 01.35-2.40 น. อากาศเย็นกับมีฟ้าหลัวชื้นปกคลุม ทัศนวิสัย 6-8 กม. เที่ยง-บ่าย มีเมฆมากปกคลุมตลอดช่วง ลมทิศ 120-130/7 นอต เวลา 15.54-15.58 น. มีฝนตกเล็กน้อย กับมีฟ้าหลัว กับมีฟ้าคะนองทิศตะวันออก ของสถานี สลับกับมีฟ้าหลัวชื้น จนถึงกลางคืน ทัศนวิสัย 8-9 กม. ลมทิศ 070/5 นอต
2,08 ก.ย. 65,24.1,30.4,150,9.3,33.1,หลังเที่ยงคืนมามีเมฆมาก ลมกำลังอ่อนทิศ 020/3 นอต อากาศเย็นกับมีฟ้าหลัวชื้นปกคลุมตลอดช่วง ทัศนวิสัย 8 กม. เวลา 08.50-11.10 น. มีฝนตกเล็กน้อย เมฆมาก บ่าย เวลา 13.15-13.35 น. เวลา 16.10-16.42 น. มีฝนตกเล็กน้อย สลับกับมีฟ้าหลัวชื้น ทัศนวิสัย 8 กม.กลางคืน มีเมฆมาก มีฝนฟ้าคะนองปานกลาง 23.40-01.35 น. ทัศนวิสัย 6-9 กม.
3,07 ก.ย. 65,24.5,31.3,020,13.0,15.4,มีฟ้าหลัวและน้ำค้างในตอนดึกถึงเช้า ทัศนวิสัย 6-10 กม. ลมทิศ 020-090 กำลัง 3 นอต ท้องฟ้ามีเมฆเป็นส่วนมากตลอดช่วงวัน และมีฝนธรรมดาตกในตอนค่ำ
4,06 ก.ย. 65,24.9,33.0,100,9.3,ไม่มีฝน,หลังเที่ยงคืนมามีเมฆเป็นส่วนมาก ลมสงบ อากาศเย็นกับมีฟ้าหลัวชื้น กับมีน้ำค้างเล็กน้อยในตอนเช้า ทัศนวิสัย 8 กม. สาย-เที่ยงทัศนวิสัยดีขึ้น อากาศค่อนข้างร้อน ลมกำลังอ่่อนทิศ 040-090/2-4 นอต เย็น-กลางคืน เมฆลดลง ลมสงบ ทัศนวิสัยดี
5,05 ก.ย. 65,25.0,31.4,240,13.0,0.6,มีฟ้าหลัวในตอนดึกถึงเช้า ทัศนวิสัย 5-10 กม. ลมทิศ 140-310 กำลัง 2 นอต ท้องฟ้ามีเมฆมากตลอดช่วงวัน และมีฝนธรรมดาตกในตอนเช้า
