,date,min_temp,max_temp,max_wind_dir,max_wind_sp,rain_24h,note
0,11 ก.ย. 65,25.2,32.8,050,13.0,1.7,เมฆมากกับมีฝนตกและมีทัศนวิสัยไม่ดีมีฟ้าหลัวในตอนเช้า
1,10 ก.ย. 65,25.2,31.0,270,18.5,0.2,เมฆมาก ทัศนวิสัย  6-10 กม เช้ามีฟ้าหรัวชื้น กลางคืนมีฝนเล็กน้อย ลมทิศตะวันตก 2 - 5 นอต
2,09 ก.ย. 65,24.1,31.9,150,13.0,0.2,ท้องฟ้ามีเมฆเต็มท้องฟ้า ทัศนวิสัยดี ลมทิศตะวันออกเฉียงใต้พัดปกคลุม
3,08 ก.ย. 65,23.7,28.5,330,14.8,11.2,มีเมฆดต็มท้องฟ้ากับมีฝนตกเป็นระยะๆทัศนวิสัยไม่ดี
4,07 ก.ย. 65,23.5,33.0,040,22.2,21.1,เมฆมากทัศนวิสัย 10 กม ลมทิศตะวันออกเฉียงเหนือ 5 - 10 กม กลางคืนมีฝนฟ้าคะนอง ฟ้าแลบ
5,06 ก.ย. 65,25.3,32.1,200,13.0,6.0,ท้องฟ้ามีเมฆเป็นส่วนมาก-เต็มท้องฟ้า ทัศนวิสัยดี ลมแปรปรวน
6,05 ก.ย. 65,25.5,33.3,300,13.0,0.1,มีเมฆมากกับมีฝนธรรมดาตกเล็กน้อย
